{
  "schemaVersion": "provider-policy.v2",
  "policyId": "paperclip-canonical-provider-policy",
  "revision": 56,
  "updatedAt": "2026-08-01T16:33:05Z",
  "runtimeClosures": {
    "hermes_python_0_18_2_frozen_1751fc251373_all_anthropic": {
      "schemaVersion": "provider-runtime-closure.v1",
      "kind": "python_venv",
      "interpreter": {
        "expectedVersion": "Python 3.12.13",
        "invocationPath": "/Users/mnm/.paperclip-local/portfolio-os-cockpit/instances/default/runtimes/hermes-agent-v0.18.2-1751fc251373-fleet-repair/venv/bin/python",
        "realpath": "/Users/mnm/.local/share/uv/python/cpython-3.12.13-macos-aarch64-none/bin/python3.12",
        "sha256": "bf16e12c72d7ae67da3f97a24da0e85ad98219bd822f2c37ac09f8d5ddc5b235",
        "shebang": "#!/bin/sh",
        "versionArgs": [
          "--version"
        ]
      },
      "files": [
        {
          "path": "/Users/mnm/.paperclip-local/portfolio-os-cockpit/instances/default/runtimes/hermes-source-1751fc2513737c61045b28f273314dedd80a531a/uv.lock",
          "sha256": "8d03d04a404c641e1c9642f0482e2d8752c57da02da94d612a5f30883b25fbca"
        }
      ],
      "directories": [
        {
          "fileCount": 7449,
          "manifestSha256": "51a217c7d4abb7b2ae0265fbe0e409367af1b42d97b7688dc97aaf3c3a28edaf",
          "rejectSymlinks": true,
          "rejectWritable": true,
          "root": "/Users/mnm/.paperclip-local/portfolio-os-cockpit/instances/default/runtimes/hermes-agent-v0.18.2-1751fc251373-fleet-repair/venv/lib/python3.12/site-packages",
          "totalBytes": 212650075
        }
      ]
    },
    "gemini_node_0_50_0": {
      "schemaVersion": "provider-runtime-closure.v1",
      "kind": "node_bundle",
      "interpreter": {
        "invocationPath": "/opt/homebrew/bin/node",
        "realpath": "/opt/homebrew/Cellar/node/25.9.0_2/bin/node",
        "sha256": "32e234a5b6bec67d72a016f2baadf7fadf3afd328470b395b73af473fdee0d85",
        "expectedVersion": "v25.9.0",
        "versionArgs": [
          "--version"
        ],
        "shebang": "#!/usr/bin/env node",
        "pathCommand": "node"
      },
      "files": [
        {
          "path": "/opt/homebrew/Cellar/ada-url/3.4.4/lib/libada.3.4.4.dylib",
          "sha256": "a55588fab581b41c9b918f4a5bab044e946091eb72cbed3bc82a8df00db189a2"
        },
        {
          "path": "/opt/homebrew/Cellar/brotli/1.2.0/lib/libbrotlicommon.1.2.0.dylib",
          "sha256": "3426742c78df5c3b523071df603f07f2bb8dea6bd8e65c366a2c6adf2bf0a3ad"
        },
        {
          "path": "/opt/homebrew/Cellar/brotli/1.2.0/lib/libbrotlidec.1.2.0.dylib",
          "sha256": "d7ac1e69b6c443341fb4302de0169d187489d58d8a641c8eadd6db9ca2cd0cbf"
        },
        {
          "path": "/opt/homebrew/Cellar/brotli/1.2.0/lib/libbrotlienc.1.2.0.dylib",
          "sha256": "32e38a8ab06c8770ea4bfaf11ea324d7bcb6fe5f07eaff9d6260f93984ee6729"
        },
        {
          "path": "/opt/homebrew/Cellar/c-ares/1.34.6/lib/libcares.2.19.5.dylib",
          "sha256": "e5595a0c640a2341e2df5a0fedaa63e7e9afe99b01c9880338064e0746414518"
        },
        {
          "path": "/opt/homebrew/Cellar/hdrhistogram_c/0.11.9/lib/libhdr_histogram.6.2.3.dylib",
          "sha256": "d1f4ba22087781611f0187787217ffef1ef97b96cd76ff2af3fb600a4434bbb6"
        },
        {
          "path": "/opt/homebrew/Cellar/icu4c@78/78.3/lib/libicudata.78.3.dylib",
          "sha256": "e7dafc3fe6613326daa30d1c930aa66219ab5524fe576b0e7b3039451652b6bf"
        },
        {
          "path": "/opt/homebrew/Cellar/icu4c@78/78.3/lib/libicui18n.78.3.dylib",
          "sha256": "f319e50c965a1a0065d2cc5595d8553ff60b0e78a2e76bc3173774fd112de9ed"
        },
        {
          "path": "/opt/homebrew/Cellar/icu4c@78/78.3/lib/libicuuc.78.3.dylib",
          "sha256": "177dab8ae0bf0b1357d7ec6404a1e145bcc3d927aa15c3064171d23b2a1fd263"
        },
        {
          "path": "/opt/homebrew/Cellar/libnghttp2/1.68.1/lib/libnghttp2.14.dylib",
          "sha256": "0a5cf2e5ff6052174b8039696bfbcbcf14d972fd51f22cdb85f6426f3b946034"
        },
        {
          "path": "/opt/homebrew/Cellar/libnghttp3/1.15.0/lib/libnghttp3.9.6.1.dylib",
          "sha256": "f16407d21bebb61f141026116f304bd02ac9c2c44f7e2aee051293290c8bcd2f"
        },
        {
          "path": "/opt/homebrew/Cellar/libngtcp2/1.22.0/lib/libngtcp2.16.dylib",
          "sha256": "a8448136ad43193e5a546b23f2c645cbf506d36bec0656cf64a98c4e4e71b58b"
        },
        {
          "path": "/opt/homebrew/Cellar/libuv/1.52.1/lib/libuv.1.0.0.dylib",
          "sha256": "34d4e2cd30b56dca5bda539f4448667360f0994c6b337ffebc5d37d818bc15d5"
        },
        {
          "path": "/opt/homebrew/Cellar/llhttp/9.3.1/lib/libllhttp.9.3.1.dylib",
          "sha256": "84d500746c0e7017b2f2a8cfb001c8788cbb83ca065db126368d1da868ac18c5"
        },
        {
          "path": "/opt/homebrew/Cellar/merve/1.2.2/lib/libmerve.1.2.2.dylib",
          "sha256": "59516d6964b86b1a0e05434f0676e1820c78ae1603474eb7fc5d74ccfd36488a"
        },
        {
          "path": "/opt/homebrew/Cellar/nbytes/0.1.4/lib/libnbytes.dylib",
          "sha256": "2ebb8415d537b47420fc46efb6d6271b93befd22b30ad2afba75ab5e2be55fcc"
        },
        {
          "path": "/opt/homebrew/Cellar/node/25.9.0_2/lib/libnode.141.dylib",
          "sha256": "a9d4a6ac7ae673af0f40f13dedccf251fa24c4a706c493db215e2490e2254c96"
        },
        {
          "path": "/opt/homebrew/Cellar/openssl@3/3.6.2/lib/libcrypto.3.dylib",
          "sha256": "ef2239cec921003b54b61968f00489271e2a2805d7d1b4e69d632423f38efe1e"
        },
        {
          "path": "/opt/homebrew/Cellar/openssl@3/3.6.2/lib/libssl.3.dylib",
          "sha256": "26ecfd43c742914a142c8b414b1f308cefe0531fcc6e38b6d45021649850e758"
        },
        {
          "path": "/opt/homebrew/Cellar/simdjson/4.6.1/lib/libsimdjson.33.0.0.dylib",
          "sha256": "ce58863124905a82f6689febfe82e73104b5784a0b49f2c4d1a85e2304080893"
        },
        {
          "path": "/opt/homebrew/Cellar/simdutf/8.2.0/lib/libsimdutf.33.0.0.dylib",
          "sha256": "fec1efa20490244aa3fc102f5629937a144511714b07aa77ab04be0493010671"
        },
        {
          "path": "/opt/homebrew/Cellar/sqlite/3.53.0/lib/libsqlite3.3.53.0.dylib",
          "sha256": "b4e993433371d8375b3db569a08789cbf2ea9ccc8c5e513d0e01b994fde73a78"
        },
        {
          "path": "/opt/homebrew/Cellar/uvwasi/0.0.23/lib/libuvwasi.dylib",
          "sha256": "c922288c5179279316b32b2c83d5c50d7b87216b442473ada8c99ef4a58ba312"
        },
        {
          "path": "/opt/homebrew/Cellar/zstd/1.5.7_1/lib/libzstd.1.5.7.dylib",
          "sha256": "e2847c4613b386683c234913ae3b7b04299254096caf7616e3b3cd9bb97a39ab"
        }
      ],
      "directories": [
        {
          "root": "/opt/homebrew/lib/node_modules/@google/gemini-cli",
          "manifestSha256": "57134908fa68798c7194113075528052cae7a7053540a98af2501e4b06a94570",
          "fileCount": 825,
          "totalBytes": 101912607,
          "rejectSymlinks": true
        }
      ]
    },
    "codex_native_0_136_0": {
      "schemaVersion": "provider-runtime-closure.v1",
      "kind": "native_binary",
      "files": [
        {
          "path": "/opt/homebrew/lib/node_modules/@openai/codex/node_modules/@openai/codex-darwin-arm64/vendor/aarch64-apple-darwin/bin/codex",
          "sha256": "2c056bf3bd3a0ba04cdaa6d1db84c81974e6785f5fd72deaa2a3fcdcfb573d10"
        }
      ],
      "directories": []
    },
    "claude_native_2_1_220": {
      "schemaVersion": "provider-runtime-closure.v1",
      "kind": "native_binary",
      "files": [
        {
          "path": "/opt/homebrew/lib/node_modules/@anthropic-ai/claude-code/bin/claude.exe",
          "sha256": "8addc857f3fe64d5a0368af9ee50321b50afb4a6918ba3ef018ab84f5dbbe081"
        }
      ],
      "directories": []
    }
  },
  "aliases": {
    "research_fast": {
      "orderedRouteIds": [
        "opencode_go_flash",
        "gemini_flash",
        "minimax_m3"
      ],
      "budgetClass": "research_normal",
      "capabilities": [
        "research",
        "tool_use",
        "structured_output"
      ]
    },
    "research_deep": {
      "orderedRouteIds": [
        "opencode_go_deep",
        "gemini_pro",
        "claude_sonnet",
        "codex_deep"
      ],
      "budgetClass": "research_escalated",
      "capabilities": [
        "deep_research",
        "long_context",
        "structured_output"
      ]
    },
    "code_fast": {
      "orderedRouteIds": [
        "opencode_go_flash",
        "minimax_m3",
        "codex_fast"
      ],
      "budgetClass": "implementation",
      "capabilities": [
        "code",
        "tool_use",
        "checkpoint_resume"
      ]
    },
    "code_deep": {
      "orderedRouteIds": [
        "minimax_m3",
        "opencode_go_deep",
        "claude_sonnet",
        "codex_deep"
      ],
      "budgetClass": "implementation",
      "capabilities": [
        "code",
        "architecture",
        "tool_use",
        "checkpoint_resume"
      ]
    },
    "multimodal_qa": {
      "orderedRouteIds": [
        "gemini_pro",
        "claude_sonnet"
      ],
      "budgetClass": "review",
      "capabilities": [
        "vision",
        "qa",
        "structured_output"
      ]
    },
    "independent_review": {
      "orderedRouteIds": [
        "opencode_zen_free",
        "minimax_m3",
        "gemini_pro",
        "claude_sonnet",
        "codex_deep"
      ],
      "budgetClass": "review",
      "capabilities": [
        "review",
        "reasoning",
        "structured_output"
      ]
    },
    "summarization": {
      "orderedRouteIds": [
        "opencode_go_flash",
        "gemini_flash",
        "claude_sonnet"
      ],
      "budgetClass": "maintenance",
      "capabilities": [
        "summarization",
        "structured_output"
      ]
    },
    "emergency_free": {
      "orderedRouteIds": [
        "opencode_zen_free"
      ],
      "budgetClass": "status_no_work",
      "capabilities": [